{
  "schemaVersion": "1.0.0",
  "curriculum": "2022-revised-special-education",
  "scope": {
    "schoolLevels": [
      "middle",
      "high"
    ],
    "curriculumTypes": [
      "basic",
      "common",
      "elective"
    ]
  },
  "baseline": {
    "noticeId": "kr-nec-2026-2",
    "asOf": "2026-08-19"
  },
  "sources": [
    {
      "id": "kr-moe-2022-34-annex1",
      "role": "base",
      "title": "특수교육 교육과정 총론",
      "issuingAuthority": "교육부",
      "noticeNumber": "교육부 고시 제2022-34호",
      "publishedDate": "2022-12-22",
      "annex": 1,
      "format": "hwp",
      "sourcePageUrl": "https://www.moe.go.kr/boardCnts/viewRenew.do?boardID=141&boardSeq=93457&lev=0&m=040401",
      "downloadUrl": "https://www.moe.go.kr/boardCnts/fileDown.do?fileSeq=24d0c6968fc7aefe3cb4d35aa4a53f33&m=040401&s=moe",
      "fileName": "kr-moe-2022-34-annex1.hwp",
      "curriculumTypes": [
        "basic",
        "common",
        "elective"
      ],
      "defaultSearch": false,
      "supersededBy": "kr-nec-2026-2-annex1",
      "rights": {
        "policy": "source-terms",
        "redistributeOriginal": false,
        "reviewRequired": true
      }
    },
    {
      "id": "kr-moe-2022-34-annex2",
      "role": "base",
      "title": "유치원 교육과정, 공통 교육과정 및 선택 중심 교육과정",
      "issuingAuthority": "교육부",
      "noticeNumber": "교육부 고시 제2022-34호",
      "publishedDate": "2022-12-22",
      "annex": 2,
      "format": "hwp",
      "sourcePageUrl": "https://www.moe.go.kr/boardCnts/viewRenew.do?boardID=141&boardSeq=93457&lev=0&m=040401",
      "downloadUrl": "https://www.moe.go.kr/boardCnts/fileDown.do?fileSeq=c3cb9e11f79efbc724a77d485dcdf8a1&m=040401&s=moe",
      "fileName": "kr-moe-2022-34-annex2.hwp",
      "curriculumTypes": [
        "common",
        "elective"
      ],
      "defaultSearch": false,
      "supersededBy": "kr-nec-2026-2-annex2",
      "rights": {
        "policy": "source-terms",
        "redistributeOriginal": false,
        "reviewRequired": true
      }
    },
    {
      "id": "kr-moe-2022-34-annex3",
      "role": "base",
      "title": "기본 교육과정",
      "issuingAuthority": "교육부",
      "noticeNumber": "교육부 고시 제2022-34호",
      "publishedDate": "2022-12-22",
      "annex": 3,
      "format": "hwp",
      "sourcePageUrl": "https://www.moe.go.kr/boardCnts/viewRenew.do?boardID=141&boardSeq=93457&lev=0&m=040401",
      "downloadUrl": "https://www.moe.go.kr/boardCnts/fileDown.do?fileSeq=0c03e8a01c523dcd9b54437fbdd030de&m=040401&s=moe",
      "fileName": "kr-moe-2022-34-annex3.hwp",
      "curriculumTypes": [
        "basic"
      ],
      "defaultSearch": false,
      "supersededBy": "kr-nec-2026-2-annex3",
      "rights": {
        "policy": "source-terms",
        "redistributeOriginal": false,
        "reviewRequired": true
      }
    },
    {
      "id": "kr-nec-2024-3",
      "role": "amendment",
      "title": "초·중등학교 교육과정 일부개정(특수교육 공통·선택 중심 적용 참조)",
      "issuingAuthority": "국가교육위원회",
      "noticeNumber": "국가교육위원회 고시 제2024-3호",
      "publishedDate": "2024-08-16",
      "annex": null,
      "format": "hwpx",
      "sourcePageUrl": "https://www.ne.go.kr/user/bbs/BD_selectBbs.do?q_bbsDocNo=20240927163706792&q_bbsSn=1016",
      "downloadUrl": "https://www.ne.go.kr/component/file/ND_fileDownload.do?q_fileId=00f33f46-d775-4f52-8273-23832dec5bfe&q_fileSn=310",
      "fileName": "kr-nec-2024-3.hwpx",
      "curriculumTypes": [
        "common",
        "elective"
      ],
      "defaultSearch": true,
      "rights": {
        "policy": "KOGL-1",
        "attributionRequired": true,
        "redistributeOriginal": false,
        "reviewRequired": false
      }
    },
    {
      "id": "kr-nec-2024-4",
      "role": "amendment",
      "title": "특수교육 교육과정 일부개정",
      "issuingAuthority": "국가교육위원회",
      "noticeNumber": "국가교육위원회 고시 제2024-4호",
      "publishedDate": "2024-08-16",
      "annex": null,
      "format": "hwpx",
      "sourcePageUrl": "https://www.ne.go.kr/user/bbs/BD_selectBbs.do?q_bbsDocNo=20240927163706792&q_bbsSn=1016",
      "downloadUrl": "https://www.ne.go.kr/component/file/ND_fileDownload.do?q_fileId=bfe1cf6f-68aa-4a59-9497-ed076f271fcf&q_fileSn=310",
      "fileName": "kr-nec-2024-4.hwpx",
      "curriculumTypes": [
        "basic",
        "common",
        "elective"
      ],
      "defaultSearch": false,
      "supersededBy": "kr-nec-2026-2-annex1",
      "rights": {
        "policy": "KOGL-1",
        "attributionRequired": true,
        "redistributeOriginal": false,
        "reviewRequired": false
      }
    },
    {
      "id": "kr-nec-2026-2",
      "role": "amendment",
      "title": "특수교육 교육과정 일부개정",
      "issuingAuthority": "국가교육위원회",
      "noticeNumber": "국가교육위원회 고시 제2026-2호",
      "publishedDate": "2026-01-21",
      "annex": null,
      "format": "pdf",
      "sourcePageUrl": "https://www.ne.go.kr/user/bbs/BD_selectBbs.do?q_bbsDocNo=20260121102419070&q_bbsSn=1016",
      "downloadUrl": "https://www.ne.go.kr/component/file/ND_fileDownload.do?q_fileId=253ed7c7-28d6-4d89-9a47-b04f57af35bc&q_fileSn=666",
      "fileName": "kr-nec-2026-2.pdf",
      "curriculumTypes": [
        "basic",
        "common",
        "elective"
      ],
      "defaultSearch": true,
      "incorporatesNoticeNumbers": [
        "국가교육위원회 고시 제2024-4호"
      ],
      "rights": {
        "policy": "KOGL-1",
        "attributionRequired": true,
        "redistributeOriginal": false,
        "reviewRequired": false
      }
    },
    {
      "id": "kr-nec-2026-2-annex1",
      "role": "base",
      "title": "특수교육 교육과정 총론(2026-2 통합본)",
      "issuingAuthority": "국가교육위원회",
      "noticeNumber": "국가교육위원회 고시 제2026-2호",
      "publishedDate": "2026-01-21",
      "annex": 1,
      "format": "hwp",
      "sourcePageUrl": "https://ncic.re.kr/bbs/ncicnotice/view/1862.do?page=1",
      "downloadUrl": "https://ncic.re.kr/srch/download.do",
      "downloadRequest": {
        "kind": "ncic-form",
        "discoveryUrl": "https://ncic.re.kr/srch/result_more.do?search=2026-2&page=1&cate=attach",
        "endpointUrl": "https://ncic.re.kr/srch/download.do",
        "filePath": "/data/uploads/ncicinvFile/org/",
        "storedFileName": "caf62388-a899-4fb0-b6bc-0b1b67e342b1.hwp",
        "originalFileName": "(2022 개정) 특수교육 교육과정 [별책1] 총론_국가교육위원회 고시 제2026-2호(2026.1.21.).hwp",
        "fileIdx": "10004191",
        "fileTbl": "NCIS_ORG_ATTACH_TYPE"
      },
      "fileName": "kr-nec-2026-2-annex1.hwp",
      "curriculumTypes": [
        "basic",
        "common",
        "elective"
      ],
      "defaultSearch": true,
      "incorporatesNoticeNumbers": [
        "교육부 고시 제2022-34호",
        "국가교육위원회 고시 제2024-4호"
      ],
      "rights": {
        "policy": "KOGL-1",
        "attributionRequired": true,
        "redistributeOriginal": false,
        "reviewRequired": false
      }
    },
    {
      "id": "kr-nec-2026-2-annex2",
      "role": "base",
      "title": "유치원, 공통 교육과정 및 선택 중심 교육과정(2026-2 통합본)",
      "issuingAuthority": "국가교육위원회",
      "noticeNumber": "국가교육위원회 고시 제2026-2호",
      "publishedDate": "2026-01-21",
      "annex": 2,
      "format": "hwp",
      "sourcePageUrl": "https://ncic.re.kr/bbs/ncicnotice/view/1862.do?page=1",
      "downloadUrl": "https://ncic.re.kr/srch/download.do",
      "downloadRequest": {
        "kind": "ncic-form",
        "discoveryUrl": "https://ncic.re.kr/srch/result_more.do?search=2026-2&page=1&cate=attach",
        "endpointUrl": "https://ncic.re.kr/srch/download.do",
        "filePath": "/data/uploads/ncicinvFile/org/",
        "storedFileName": "c0811924-a27a-4369-9b72-c495e9a1ec04.hwp",
        "originalFileName": "(2022 개정) 특수교육 교육과정 [별책2] 유치원, 공통 및 선택 중심_국가교육위원회 고시 제2026-2호(2026.1.21.).hwp",
        "fileIdx": "10004195",
        "fileTbl": "NCIS_ORG_ATTACH_TYPE"
      },
      "fileName": "kr-nec-2026-2-annex2.hwp",
      "curriculumTypes": [
        "common",
        "elective"
      ],
      "defaultSearch": true,
      "incorporatesNoticeNumbers": [
        "교육부 고시 제2022-34호",
        "국가교육위원회 고시 제2024-4호",
        "국가교육위원회 고시 제2024-3호",
        "국가교육위원회 고시 제2026-1호"
      ],
      "rights": {
        "policy": "KOGL-1",
        "attributionRequired": true,
        "redistributeOriginal": false,
        "reviewRequired": false
      }
    },
    {
      "id": "kr-nec-2026-2-annex3",
      "role": "base",
      "title": "특수교육 기본 교육과정(2026-2 통합본)",
      "issuingAuthority": "국가교육위원회",
      "noticeNumber": "국가교육위원회 고시 제2026-2호",
      "publishedDate": "2026-01-21",
      "annex": 3,
      "format": "hwp",
      "sourcePageUrl": "https://ncic.re.kr/bbs/ncicnotice/view/1862.do?page=1",
      "downloadUrl": "https://ncic.re.kr/srch/download.do",
      "downloadRequest": {
        "kind": "ncic-form",
        "discoveryUrl": "https://ncic.re.kr/srch/result_more.do?search=2026-2&page=1&cate=attach",
        "endpointUrl": "https://ncic.re.kr/srch/download.do",
        "filePath": "/data/uploads/ncicinvFile/org/",
        "storedFileName": "d081fe45-551f-475c-a223-d633a2d63c93.hwp",
        "originalFileName": "(2022 개정) 특수교육 교육과정 [별책3] 기본 _ 국가교육위원회 고시 제2026-2호(2026.1.21.).hwp",
        "fileIdx": "10004193",
        "fileTbl": "NCIS_ORG_ATTACH_TYPE"
      },
      "fileName": "kr-nec-2026-2-annex3.hwp",
      "curriculumTypes": [
        "basic"
      ],
      "defaultSearch": true,
      "incorporatesNoticeNumbers": [
        "교육부 고시 제2022-34호",
        "국가교육위원회 고시 제2024-4호"
      ],
      "rights": {
        "policy": "KOGL-1",
        "attributionRequired": true,
        "redistributeOriginal": false,
        "reviewRequired": false
      }
    },
    {
      "id": "kr-nec-2026-1-annex3",
      "role": "base",
      "title": "중학교 교육과정(특수교육 공통·선택 중심 준용)",
      "issuingAuthority": "국가교육위원회",
      "noticeNumber": "국가교육위원회 고시 제2026-1호",
      "publishedDate": "2026-01-21",
      "annex": 3,
      "format": "hwp",
      "sourcePageUrl": "https://ncic.re.kr/bbs/ncicnotice/view/1859.do?page=1",
      "downloadUrl": "https://ncic.re.kr/srch/download.do",